job_title,company,location,experience,posted,description,skills
Lead Gen Ai Data Scientist  Genai,Neal Analytics,Mumbai Pune Chennai Gurugram Bengaluru,49 Yrs,3 Weeks Ago,Demonstrate Excellent Communication Skills And The Ability To Work Effectively In A Tea,Career Development Gcp Analytical Machine Learning Application Development Open Source Analytics Sql
Data Scientist,Comscore Technologies,Kolkata Mumbai New Delhi Hyderabad Pune Chennai Bengaluru,24 Yrs,3 Weeks Ago,Understand Traditional Tv Media Math And Targeting Concepts  Phd Or Masters Ms In ,Digital Media Analytical Debugging Cms Market Research Sem Data Mining Analytics
Revit Developer,Programmingcom,Mumbai Chandigarh Hyderabad Pune Panchkula Chennai Gurugram Bengaluru,14 Yrs,3 Weeks Ago,Qualificationseducation Bachelor S Degree In Computer Science Engineering Archite,Analytical Skills Version Control Git Vbnet Bim Programming Revit Visual Studio
Adobe Ajo Consultant,Tech Stalwart Solution,Kolkata Mumbai New Delhi Hyderabad Pune Chennai Bengaluru,45 Yrs,3 Weeks Ago,Qualifications  Experience  45 Years Of Experience In Customer Journey Orchestratio,Training Adobe Analytics Orchestration Cloud Automation Tools Sms Adobe Customer Engagement
Data Scientist,Roblox,Kolkata Mumbai New Delhi Hyderabad Pune Chennai Bengaluru,58 Yrs,3 Weeks Ago,5 Years Of Experience As A Data Scientist Data Engineer Or Related Roleexperience Ma,San Prototype People Development Data Management Analytical Genetics Operations Analytics
Sac Planning Developer,Bytespoke Com,Kolkata Mumbai New Delhi Hyderabad Pune Chennai Bengaluru,57 Yrs,3 Weeks Ago, Proficient In Abap  Amdp Rkf  Ckf Bex And Eclipse Ide 5 Years Of Sap Bw On Hana,Basic Eclipse Cloud Sap Bw Troubleshooting Analytics Abap Planning
Zuora Developer,Acme Services,Kolkata Mumbai New Delhi Hyderabad Pune Chennai Bengaluru,17 Yrs,3 Weeks Ago,Willingness To Work Atleast In Afternoon Shift Starting From 200Pm To 1030Pmminimum 1,Change Management Jquery Analytical Billing Javascript Customer Service Release Management Sql
Consultant,Aster Medcity,Kolkata Mumbai New Delhi Hyderabad Pune Chennai Bengaluru,07 Yrs,3 Weeks Ago,Prepared To Understand And Follow The Hospital Rules And Regulations And Demonstrate P,Analytical Skills Head Business Development Patient Care Mentor Research Administration Work Teaching Consulting
Consultant,Ca Monk,Kolkata Mumbai New Delhi Hyderabad Pune Chennai Bengaluru,25 Yrs,3 Weeks Ago,It Skillsshould Be Good With Ms Excel Ms Word And Ms Powerpoint Candidate Shall Be R,Enterprise Risk Management Manager Internal Audit Erp Sap Analytical Consulting Oracle Powerpoint
Lead Gen Ai Data Scientist  Genai,Fractal Analytics,Mumbai Pune Chennai Gurugram Bengaluru,27 Yrs,3 Weeks Ago,Demonstrate Excellent Communication Skills And The Ability To Work Effectively In A Tea,Career Development Gcp Analytical Machine Learning Application Development Open Source Analytics Sql
Datasphere Consultant,Systechcorp Inc,Kolkata Mumbai New Delhi Hyderabad Pune Chennai Bengaluru,512 Yrs,3 Weeks Ago,This Is A Migration Project Where We Will Migrate From Bw To Datasphere Since Data,Access Control Usage Sap Team Management Analytical Client Interaction Client Relationship Business Intelligence
Process Associate  Due Diligence,Genpact,Noida,13 Yrs,2 Weeks Ago,Ready To Shape The Future Of Work At Genpact We Dont Just Adapt To Changewe Drive,Aml Due Diligence Analytical Customer Service Office Microsoft Research Ms Office Outlook
Data Scientist With Salesforce Einstein,Suse,Bengaluru,510 Yrs,2 Weeks Ago,The Cfl Data Scientist Role Is Responsible For Providing Reporting And Analytical ,Linux Sales Operations Business Analytics Analytical Customer Support Continuous Improvement Forecasting Operations
Data Scientist,Diverse Lynx,Bengaluru,45 Yrs,2 Weeks Ago,Jd For Data Scientist Role Description Ai  Ml  Image Analytics With Large Data And ,Data Science Scalability Artificial Intelligence Machine Learning Mentor Deployment Forecasting Analytics
Associate,Adcanopus Digital Media,Bengaluru,12 Yrs,2 Weeks Ago,Preferred Qualifications  Collaborate With Creative Landing Page And Tech Teams To ,Quality Lead Health Insurance Digital Media Lead Generation Compliance Analytical Legal Digital Marketing
Antenna Simulation Developer,Elk Education,Chennai,13 Yrs,3 Weeks Ago,Develop And Maintain Technical Documentation Including Test Plans And Reports  Should,Fabrication Training Simulation Analytical Query Medical Insurance Research Matlab
Data Scientist,Hanker Systems India,Chennai Bengaluru,812 Yrs,2 Weeks Ago,Good Understanding Of How To Apply Predictive And Machine Learning Techniques Like Prof,Pyspark Statistics Pytorch Python Flask Random Forest Machine Learning Neo4J
Data Scientist  Natural Language Processingainl,Leading Client,Gurugram,27 Yrs,2 Weeks Ago,Problem Solving Attitude Is A Mustexpert Level Knowledge In Machine Learning Algorithms,Python Natural Language Processing Text Analytics Text Mining Machine Learning Algorithms Algorithms Machine Learning Business Intelligence
Data Scientist,Tesco Plc,Bengaluru,48 Yrs,2 Weeks Ago,Experience In One Or More Of The Following Fields Is Required Predictive Modelling Str,Supply Chain Computer Science Computer Vision Prototype Analytical Machine Learning Predictive Modeling Data Mining
Associate Sox,Apollo Global Management,Mumbai,57 Yrs,2 Weeks Ago,We Must Never Lose Our Focus And Determination To Be The Best Investors And Most Truste,Relationship Management Manager Internal Audit Cisa External Audit Analytical Coso Asset Management Investment Management
Iics Developer,Euclid Innovations,Warangal Hyderabad Nizamabad,38 Yrs,2 Weeks Ago,A Minimum Of 4 Years Of Experience In Iics Data Integration Development High Degree Of,Analytical Skills Sql Queries Technology Consulting Technical Design Shell Scripting Agile Unix Operating System Project Delivery
Consultant,Lexisnexis Risk Solutions,Mumbai,510 Yrs,2 Weeks Ago, 510 Years Of Petrochemical  Polymer Industry Experience Or In Commercial Execution ,Health Insurance Chemical Engineering Analytical Project Management Finance Consulting Banking Data Analytics
Associate  Process Engineering,Primetrace Technologies,Gurugram,03 Yrs,2 Weeks Ago,Our Technology Empowers Millions Of Investors To Save For Retirement Pay For College ,Product Management Core Java Hibernate Tdd Analytical Mysql Healthcare Apache
Data Scientist,Huron,Bengaluru,56 Yrs,2 Weeks Ago,Experience With Aws Tools Such As Sagemaker Redshift Athena S3This Role Requires Han,Mining Claims Analytical Healthcare Oracle Forecasting Operations Monitoring
Consultant,Relx Group,Mumbai,510 Yrs,2 Weeks Ago,Demonstrate Knowledge Of The Petrochemical Industry And Market Fundamentals  510 Yea,Health Insurance Chemical Engineering Analytical Project Management Finance Consulting Banking Data Analytics
Process Associate,Augtech Nextwealth It Services,Durg Bhilainehru Nagar East,03 Yrs,2 Weeks Ago,Bachelors Degree In Any Field Technical Background Preferredplease Note Candidates Wit,Communication Skills Pressure Handling Written Communication Analytical Problem Solving Convincing Power Strong Communication Skills Interpersonal Skills
Data Scientist  Machine Learning  Artificial Intelligence,Leading Client,Kolkata,57 Yrs,3 Weeks Ago, Experience Working With Slack App Development And Deployment   Background In Mlops,Artificial Intelligence Machine Learning Data Science Data Visualization Data Modeling Data Analytics Looker Llm
Data Scientist  Sqlpython,Leading Client,Mumbai,510 Yrs,3 Weeks Ago,Responsibilities  Data Exploration And Insights   Conduct Continuous Data Exploratio,Data Science Data Validation Data Quality Data Scientist Jupyter Data Analytics Sql Python
Data Scientist  Machine Learningartificial Intelligence,Leading Client,Mumbai,57 Yrs,3 Weeks Ago, Experience Working With Slack App Development And Deployment   Background In Mlops,Machine Learning Data Science Mlops Artificial Intelligence Data Visualization Data Modeling Data Analytics Looker
Associate Category  Bags,Meesho,Bengaluru,14 Yrs,3 Weeks Ago,Be  Btech Graduate  14 Years Of Overall Experience With At Least 1 Years In Leadi,Third Party Logistics Excel Performance Management Analytical Ecommerce Business Development Executive Medical Insurance Cost
Research Associateard,Jodas Expoim,Hyderabad,26 Yrs,3 Weeks Ago,Key Responsibilitiesdevelop And Validate Robust Analytical Methods Eg Hplc Gc L,Analytical Method Development Gas Chromatography Hplc Method Development Analytics Development Chromatography Research
Associate,Pwc Service Delivery Center,Bengaluru,2429 Yrs,3 Weeks Ago,Management Level Associate  Summary As A Sap Consulting Generalist A,Supply Chain Architecture Coding System Integration Budgeting Business Process Modeling Software Implementation Operations
Data Scientist,Irt Digital Analytics Solutions,Gurugram,35 Yrs,3 Weeks Ago,Educational Background Bachelors Or Masters Degree In A Quantitative Field Computer S,Customer Analytics Python Segmentation Sales Forecasting Ai Ml Sales Forecasting
Crm Developer,Aryavart Institute Of Technology,Noida Patna Kanpur Supaul,13 Yrs,3 Weeks Ago,Qualifications  Bachelors Degree In Computer Science Information Technology Or A Rel,Automation Data Modeling Debugging Javascript Http Analytics Crm Python
Tableau Developer,Thoucentric,Hubli Mangaluru Mysuru Bengaluru Belgaum,23 Yrs,3 Weeks Ago,Design Develop And Maintain Tableau Dashboards And Reports Collaborate With Busines,Unix Automation Publishing Google Analytics Web Analytics Analytical Consulting Business Intelligence
Od Consultant,Thoucentric,Hubli Mangaluru Mysuru Bengaluru Belgaum,36 Yrs,3 Weeks Ago,Job Description  ,Product Management Supply Chain Relationship Management Organizational Development Project Management Analytical Consulting Management Consulting
Kinaxis Consultant,Thoucentric,Hubli Mangaluru Mysuru Bengaluru Belgaum,48 Yrs,3 Weeks Ago, Certification Author Level 1 2   Expected Experience 4  8 Years Handson Experi,Product Management Supply Chain Process Design Project Management Consulting Management Consulting Supply Chain Planning Manager Technology
Omp Consultant,Thoucentric,Hubli Mangaluru Mysuru Bengaluru Belgaum,49 Yrs,3 Weeks Ago, 4 Years Of Experience In Largescale Supply Chain Programsexperience In Planning Tra,Product Management Supply Chain Erp Project Management Pharma Consulting Management Consulting Supply Chain Planning
Research Associate,Akums,Chandigarh,38 Yrs,3 Weeks Ago,Preferred Candidate Profile  Post Graduate Mpharma  Msc Must Be From Pharmaceutica,Aas Iso Icpms Hplc Analytical Method Validation Wet Lab Glp Method Validation
Consultant,Trigyn Technologies,Bengaluru,37 Yrs,3 Weeks Ago,Build And Evolve Service Offerings Across Digital Cloud Transformation User Experien,Lead Generation Sap Client Engagement Strategic Leadership Microsoft Dynamics Oracle Rfp Digital Transformation
Research Associate  Lcms  Api ,Cadila Pharmaceuticals,Ahmedabad,37 Yrs,3 Weeks Ago,Must Have Worked In Api Industry Must Have Worked In Method Development On Lcms Must Ha,Lcms Method Development Analytical Method Development Analytics Development Research Methods Api
Data Scientist,Thomson Reuters,Hyderabad,38 Yrs,3 Weeks Ago,The Data Scientist Organization Within The Data And Analytics Division Is Responsible F,Python Machine Learning Sql Data Science Statistical Modeling Natural Language Processing Scikitlearn Glue
Data Scientist,Alstom Transportation,Bengaluru,59 Yrs,3 Weeks Ago,Experience In Building And Optimizing Supervised And Unsupervised Ml Modelsapplying Str,Python Software Testing Linux Internals Artificial Intelligence Machine Learning Algorithms Natural Language Processing Video Analytics Sql
Mid Data Scientist,Reflections Global,Kochi Bengaluru Thiruvananthapuram,510 Yrs,3 Weeks Ago,Bachelors Or Masters Degree In A Quantitative Field Such As Statistics Mathematics Co,Computer Science Computer Vision Cloud Computing Gcp Analytical Artificial Intelligence Machine Learning Natural Language Processing
Consultant,Inspira Enterprise India,Mumbai,58 Yrs,3 Weeks Ago,58 Years Of Relevant Experience In Red Teaming Penetration Testing Or Offensive Secu,Linux Simulation Powershell Gcp Analytical Nmap Windows Physical Security
Kdb Developer,Mthree Com,Chennai Gurugram,35 Yrs,3 Weeks Ago,About Us Mthree Gives You A Foot In The Door To Your Dream Career We Ve Helpe,Front Office Prototype Git Aviation Agile Data Structures Healthcare Data Analytics
Developer,Expora Database Consulting Services,Hyderabad Gurugram Bengaluru,510 Yrs,3 Weeks Ago,This Is A Truly Unique Opportunity To Be Part Of A Platform Transformation Team With,Change Management Front End Pdf Ldap Active Directory Troubleshooting Project Delivery Directory Services
Apigee Developer,Diverse Lynx,Mumbai,05 Yrs,3 Weeks Ago,Api Development  Design And Develop Restful Apis Using Apigee Edge  Api,Performance Tuning Backend Debugging Javascript Deployment Unit Testing Management Analytics
Global Category Assoc Dir,Horizon Therapeutics,Hyderabad,48 Yrs,3 Weeks Ago,Experience Leading Large Crossfunctional Teams And Managing Complex Global Projects I,Procurement Process Automation Change Management Erp Operational Risk Legal Compliance Strategic Sourcing Risk Management
Data Scientist,Numerator,Remote,25 Yrs,3 Weeks Ago,A Higher Degree In A Relevant Field Is Preferred But Not Required Data Handling Hands,R Git Data Science Regression Data Modeling Shiny Machine Learning Analytics
Process Associate,Bayer Zydus Pharma,Bengaluru,02 Yrs,3 Weeks Ago,Should Be Able To Plan Prioritize The Work Allocated On Daily Basis And Let Sme  Lead ,Process Associate Analytical Skills Dso Sap Accounting Focus Vendor Management
Spfx Sp Developers,Fusion Plus Solutions,Hyderabad,510 Yrs,3 Weeks Ago,Detailed Jd Roles And Responsibilities Design Develop And Maintain Shar,Analytical Skills Git Powershell Sharepoint Development Troubleshooting Microsoft Project Delivery Sharepoint
Mean Developer,Irisidea,Bengaluru,49 Yrs,3 Weeks Ago,Irisidea Technologies Is Looking For Mean Developer To Join Our Dynamic Team And Embark,Sap Consulting Javascript Agile Html Apache Data Mining Analytics
Consultant,Slk Software,Bengaluru,2025 Yrs,3 Weeks Ago, Education Qualification  Engineering Graduate  Bsc In Computer Science  Informatio,Computer Science System Testing Automation Coding Integration Testing Test Planning Visio Investment Management
Data Scientist,Algoleap Technologies,Hyderabad,611 Yrs,3 Weeks Ago,Experience In Ml Ops Model Deployment Model Lifecycle And Management  Experience Dep,Deep Learning Data Science Analytical Machine Learning Cloud Programming Transformers Deployment
Sac Developer,Hilti,Pune,38 Yrs,3 Weeks Ago,Diversity And Inclusion Is One Of Our Keythemes In Our Team Of Over 34 000 Employees ,Front End Eclipse Analytical Agile Data Quality Information Management Analytics Sql
Apigee Developer,Diverse Lynx,Kochi,38 Yrs,3 Weeks Ago,Required Qualifications  3 Years Of Handson Experience With Apigee Edge Or Apigee X,Automation Backend Git Cloud Services Xml Devops Cloud Json
Data Scientist,Tesco,Bengaluruwhitefield,13 Yrs,2 Weeks Ago, Applied Math Applied Statistics Design Of Experiments Linear  12 Year Experienc,Data Science Advanced Excel Data Analytics Python Sql Applied Mathematics Machine Learning Statistics
Tagetik Developer,Luxoft,Pune,37 Yrs,3 Weeks Ago,Development And Customization Develop And Customize Tagetik Applications Includ,Test Scripts Performance Management Jboss Controlm Workflow Application Development Budgeting Troubleshooting
Tagetik Developer,Luxoft,Bengaluru,37 Yrs,3 Weeks Ago,Development And Customization Develop And Customize Tagetik Applications Includ,Test Scripts Performance Management Jboss Controlm Workflow Application Development Budgeting Troubleshooting
Data Scientist,Thoucentric,Hybrid  Bengaluru,24 Yrs,3 Weeks Ago,Preferred Candidate Profile  Excellent Communication And Interpersonal Skills To Inter,Time Series Forecasting Pricing Analytics Demand Forecasting Python Pricing Simulator Arima Xgboost Bert
Data Scientist Iii Row Aop,Amazon,Hyderabad,510 Yrs,3 Weeks Ago,The Aop Analytics Operations And Programs Team Is Responsible For Creating Core Anal,Computer Science Publishing Sas Analytical Machine Learning Business Intelligence Matlab Distribution System
Research Executive  Dxi,Edelman,Mumbai,16 Yrs,3 Weeks Ago,We Value Diversity Our Team Is Made Up Of Practitioners From Different Culture Origins,Qualitative Research Metadata Excel Political Science Business Analytics Social Media Healthcare Consultancy
Sac Developer,Hilti,Pune,38 Yrs,3 Weeks Ago,Specification Background Minimum Bachelor S In Computer Science  Technologydata Scie,Computer Science Front End Eclipse Analytical Agile Data Quality Information Management Analytics
Research Executive  Dxi,Daniel J Edelman Holdings Inc,Mumbai,16 Yrs,3 Weeks Ago,We Value Diversity Our Team Is Made Up Of Practitioners From Different Culture Origins,Qualitative Research Metadata Excel Political Science Business Analytics Social Media Healthcare Consultancy
Data Scientist,Netcore Cloud,Mumbai Bengaluru,37 Yrs,3 Weeks Ago,Programming Machine Learning Artificial Intelligence Data Science Business Analytic,C Product Engineering Nosql Business Analytics Artificial Intelligence Mysql Machine Learning Mongodb
Associate,Nomura,Mumbai,510 Yrs,3 Weeks Ago,Job Title Associate Job Code 10019 Country In ,Data Management Wealth Management Process Improvement Analytical Investment Banking Risk Management Analytics Financial Services
Aep And Ajo Developer,Market Scope,Bengaluru,46 Yrs,3 Weeks Ago,Experience Implementing And Managing Xdm Schemas And Datasets Strong Understanding Of ,Orchestration Agile Scrum Scalability Data Governance Management Adobe Sdlc Analytics
Iacautomationsr Consultant,Algoleap Technologies,Bengaluru,78 Yrs,3 Weeks Ago,The Ideal Candidate Will Have A Minimum Of 78 Yearsof Relevant Experience With A Stro,Automation Linux Gcp Analytical Configuration Management Shell Scripting Data Structures Monitoring
Mern Developer,Irisidea,Bengaluru,38 Yrs,3 Weeks Ago,Mern Developer  Realtime Data Streaming Realtime Data Processing Realtime Data An,Sap Consulting Agile Mongodb Html Apache Data Mining Analytics
Mern Developer,Konrad Group,Gurugram,16 Yrs,3 Weeks Ago,Socials Outings  Retreats  One Day Per Week Work From Home Flexibility  Culture Of ,Computer Science Web Application Development Dom Enterprise Applications Analytical Genetics Http Ios Development
Social Associate,Grant Thornton India Pvt Ltd,Kolkata Bengaluru,35 Yrs,3 Weeks Ago,Experience Using Social Media Management Platform Hootsuite Preferred  Strong Analyt,Web Analytics Media Strategy Social Media Scheduling Microsoft Dynamics Management Seo Digital Marketing
Programmatic  Forensic  Surveillance Associate,Millennium Management,Bengaluru,810 Yrs,3 Weeks Ago,Programmatic  Forensic  Surveillance Associate Who We Are Millennium M,Analytical Skills Financial Markets Bloomberg Compliance Ms Outlook Forensic Investment Management Management
Data Scientist  Insurance Domain,Amit Gaikwad,Hybrid  Bengaluru,510 Yrs,2 Weeks Ago,Produce Written Reports Problem Statements Methods Interpretation  Business Implicat,Algorithm Development Eda Scikitlearn Azure Devops Python Logistic Regression Artificial Intelligence Insurance Domain
Consultant,Bain,Bengaluru,17 Yrs,3 Weeks Ago,Given The Workload And Performance Expectations Of This Position Consultants Are Regul,Training Career Development Analytical Finance Consulting Retail Finance Healthcare Business Management
Data Scientist,Rosh,Kochi,28 Yrs,2 Weeks Ago,Salarynull Remotejobfalse Postingtitledata Scientist Islockedfalse ,Computer Science Analytical Machine Learning Signal Processing Vehicle Dynamics Automotive Analytics Sql
Associate Is,Horizon Therapeutics,Hyderabad,19 Yrs,2 Weeks Ago,Career Category Information Systems Job Description Join Amgen S Mission Of Serving P,Computer Science Application Support Pharma Analytical Debugging Agile Software Development Life Cycle Oncology
Associate,Pwc Service Delivery Center,Gurugram,13 Yrs,3 Weeks Ago,Preferred Skill Set Oracle Fusion Technical Year Of Experience Required3,Supply Chain Management Paas Software Development Life Cycle Oracle Fusion Oracle Troubleshooting Technical Support Sdlc
Data Scientist,Axis Asset Management Company,Mumbai,1218 Yrs,3 Weeks Ago,Bachelor S Degree In Quantitative Disciplines Statistics Engineering Operations Rese,Operations Research Team Leading Sales Operations Project Management Machine Learning Data Governance Data Quality Data Integrity
C Developer,Microquery,Mumbai,25 Yrs,3 Weeks Ago,Possess An Excellent Handson Experience In Relational Database Design And Development,Server Erp Code Technical Software Windows Microsoft Ajax
Process Associate,Sdm Process Solutions,Gurugram,13 Yrs,3 Weeks Ago,Fast Typing Skills  Good Command Of English Both Oral And Written  Strong Comprehensi,Process Associate San Backend French Analytical Corporate Cook Ms Office Word
Consultant,Gauri Technologies,Pune,510 Yrs,3 Weeks Ago,55 Years Of Salesforce Implementation Experience Preferred 3 Minimum Ends To End Cycl,Continuous Integration Version Control Git Sales Development Testing Customer Satisfaction Analytical Deployment
Data Scientist,Particle Black,Chennai,26 Yrs,3 Weeks Ago,Analyze Complex Data Sets And Develop Aiml Models Using Python To Drive Actionable Ins,Algorithms Python Predictive Machine Learning Algorithms Mlpredictive Analytics Machine Machine Learning Analytics
Associate,Pwc Service Delivery Center,Mumbai,13 Yrs,3 Weeks Ago,Minimum 2 Implementation In Domestic India Market In Oracle Ebs Erp Package Scm Modul,Analytics  Features Oracle Compliancereporting Compliance Reporting
Research Associate Artificial Intelligence,Recodeminds,Hyderabad,24 Yrs,3 Weeks Ago,Experience Using Business Intelligence Tools And Data Frameworks Like Tensorflow Mxnet,Computer Science Elearning Operations Research French Coding Analytical Data Mining Business Intelligence
Graphql Developer,Comviva Technology,Bengaluru,57 Yrs,3 Weeks Ago,Familiarity With Database Technologies Such As Mysql Oracle And Mongodb  Good Experi,Git Analytical Mysql Debugging Agile Splunk Mongodb Oracle
Developer,Zyde Soft,Chennai,314 Yrs,3 Weeks Ago,Were Looking For A Highly Skilled Android Developer Who Is Passionate About What The,Business Process Health Insurance Version Control Git Xml Analytical Debugging Android Sdk
Wordpress Consultant,Digital Business People,Noida Lucknow,23 Yrs,3 Weeks Ago,Minimum Diploma Holders Or Above In It Or Software Engineering   23 Years Of Experie,Backend Jquery Social Media Mysql Wordpress Javascript Php Xhtml
Freshers  Developer,Baryons Software Solutions,Bengaluru,01 Yrs,3 Weeks Ago,Baryons Software Solutions Is Looking For Freshers  Developer To Join Our Dynamic Team,Qa Analytical Analytics Quality Assurance Development
Data Scientist,Equifax Credit Information Services Private Limited,Bengaluru,35 Yrs,3 Weeks Ago,You Will Build Experience Developing Analytical Approaches To Meet Business Requirement,Computer Science Operations Research Analytical Machine Learning Algorithm Development Data Structures Healthcare Test Cases
Data Scientist,Scalein,Bengaluru,49 Yrs,3 Weeks Ago,Basic Understanding And Experience With Hadoop And Map Reduce Concepts  Experience Wi,Performance Tuning Analytical Postgresql Administration Perl Sql Nosql Analytics
Vc Mfc Developer,Aritha,Bengaluru,310 Yrs,3 Weeks Ago,Background In Pcbased Tools In A Windows Environment Fluent In C Vc Mfc ,Version Control Vc Management Systems Configuration Management Agile Scrum Data Analytics Windows
Hiring Data Scientist  Pune,People Powered Solutions,Punekalyani Nagar,36 Yrs,3 Weeks Ago,Requirement  Masters Degree In Statistics Or Computer Science Or Bachelors Degree Wit,Python Data Science Big Data Analytics Predictive Modeling Data Scientist Machine Learning Business Intelligence Sql
Att Demandsoac Developer,Diverse Lynx,Gurugram,14 Yrs,3 Weeks Ago,Meeting With The It And Design Team To Discuss Application Requirements Designing ,Cloud Developer Oracle Analytics Development T
Quant Developer,Algorithma,Kochi,25 Yrs,3 Weeks Ago,Bachelors Degree In Computer Science Mathematics Physics Engineering Or Related Fie,Computer Science Career Development C Financial Products Programming Risk Management Analytics Monitoring
Research Associates,Avirainsights Technologies,Pune,01 Yrs,3 Weeks Ago, Soft Skills  Must Have Good Communication Skills And Decisionmaking Skills Experie,Business Writing Team Management Quantitative Research Project Management Consulting Data Analytics Research Powerpoint
Bods Consultant,Redberry,Mumbai,34 Yrs,3 Weeks Ago,The Consultantwill Be Responsible Fordevelopmentof Etl Jobs In Sap Data Services Consu,Administration Ms Sql Nbfc Analytical Mutual Funds Sap Data Services Electronics Customer Service
Research Associate,Ang Lifesciences,Amritsar,27 Yrs,3 Weeks Ago,Candidate Should Have Experience In Ndds Product Development Of Parenteral Dpi Forms F,Ndds Pharmaceutics Analytical Process Development Manager Technology Troubleshooting Research Associate Business Executive
Data Scientist,Algoleap Technologies,Bengaluru,57 Yrs,3 Weeks Ago,Jobdescription Data Scientist Jd Someone With 57 Years Of Experience Data Collect,C Business Objects Google Analytics Simulation Coding Analytical Mysql Javascript
Forensics  Associate,Grant Thornton India Pvt Ltd,Bengaluru,13 Yrs,3 Weeks Ago,Should Be Proficient In Ms Excel And In Other Microsoft Office Suite Should Have Strong,Vendor Audit Financial Statements Interpersonal Skills Excel Project Monitoring Risk Assessment Analytical Research Litigation Support
