job_title,company,location,experience,posted,description,skills
Analyst,Eclerx,Mumbai,02 Yrs,2 Weeks Ago,At Eclerx We Believe In Nurturing Talent And Providing Handson Experience  Eclerx F,Investment Banking Capital Market Derivatives Investment Banking Operations Fixed Income Settlements Trading Data Management
Record To Report Ops Analyst,Accenture,Gurugram,35 Yrs,1 Day Ago,Qualifications Any Graduation Skill Required Record To Report  Intercompany Account ,Service Operations Journal Entries Forecasting Reporting Analysis Record To Report Hlookup Macros Data Analysis
Lead Specialist Metrics Analytics  Reporting,Mercer,Noida Gurugram,510 Yrs,2 Weeks Ago,Company Mercer Description We Are Seeking A Talented Individual To Join Our Transf,Project Management Call Center Operations Presentation Skills Rta Wfm Data Analysis Mis Reporting Forecasting
Analyst,Barclays,Chennai,110 Yrs,1 Week Ago,Ca And  Or Mba Graduates With Strong Academic Record And Few Years Of Experience In Ac,Analyst Financial Reporting Finance Service Excellence Financial Risk Management Continuous Improvement Operations Cost
Analyst  Angular,Deloitte Consulting,Bengaluru,04 Yrs,1 Day Ago,Deloitte South Asia Llp Y Our Potential Unleashed I,Automation Data Management Performance Management Analytical Machine Learning Javascript Workflow Business Intelligence
Lec Analyst Lec Analyst,Jpmorgan Chase Bank,Bengaluru,010 Yrs,5 Days Ago,Shift Timing 30 Noon To 30Pmrequired Qualifications Capabilities And Skills  Ca  Mb,Automation Us Gaap Financial Reporting Regulatory Reporting Financial Analysis Ecb Analytical German
Analyst,Crisil,Pune,25 Yrs,6 Days Ago,Required Skills  Qualificationscompetence In Reporting Tools And Dashboard Creation E,Bi Data Warehousing Sharepoint Dashboards Sql Analytics Change Control Oos
Fpa Analyst,3M India,Bengaluru,35 Yrs,3 Weeks Ago,Experience 35 Years Of Relevant Experience In Financial Planning  Analysis Or A Simi,Supply Chain Data Analysis Financial Reporting Cma Process Improvement Analytical Financial Planning Variance Analysis
Advertising Ops Analyst,Amazon,Bengaluru,06 Yrs,1 Day Ago,Bachelors Degree Experience Analyzing Data And Best Practices To Assess Performance Dri,Display Advertising Data Analysis Campaign Management Analytical Ecommerce Account Management Online Advertising Operations
Programmatic  Analyst,Annalect,Bengaluru,23 Yrs,1 Day Ago,Qualifications A Fulltime Graduate Degree Mandatory 2 To 3 Years Of Experience In Ma,Public Relations Advertising Agency Analytical Consulting Market Research Support Services Troubleshooting Digital Marketing
Analyst,Nomura,Mumbai,16 Yrs,3 Weeks Ago,Experience  1 Year  Qualification  Graduate Postgraduate  Mbaca  Requisition Nop,Financial Reporting Wealth Management Mis Cma Investment Banking Investment Management Information Technology Financial Services
Workday Reporting Analyst,Leading Client,Bengaluru,45 Yrs,2 Weeks Ago,Develop And Maintain Reports Within Workday Utilizing Workdays Reporting Tools To Gen,Data Analysis Sql Reporting Analysis Advanced Excel Reporting Tools Hlookup Macros Data Analytics
Csm Ops Analyst,Xpheno,Noida,57 Yrs,3 Weeks Ago,Ability To Work In Shifts 24Xmost Likely To Work On Emea Time Zone 1230930 Pm Bach,Analyst Data Analysis Erp Automation Mis Analytical Salesforcecom Macros
Lead Analyst Fdsa,Lowes Services India Private Limited,Bengaluru,510 Yrs,3 Weeks Ago,Lowe S Companies Inc Nyse Low Is A Fortune 50 Home Improvement Company Serving,Financial Reporting Financial Analysis Analytical Corporate Finance Budgeting Microsoft Business Intelligence Financial Modelling
Abm Analyst,American Express Global Business Travel,Mumbai Gurugram Chennai,07 Yrs,4 Days Ago, 2 4 Years Of Experience In Marketing Operations Campaign Execution Or Abm Support ,Qa Senior Analyst Consulting Marketing Operations Adobe Commercial Sales Analytics Crm
Sr Analyst  Fpa,Lennox India Technology Centre Litc,Chennai,16 Yrs,1 Day Ago,Requires A Bachelors Degree Or An Equivalent Combination Of Education And Experience  ,Supply Chain Financial Statements Excel Financial Reporting Accounting Billing Manager Technology Ventilation
Senior Fpa Analyst,Qad,Mumbai,46 Yrs,1 Week Ago,The Senior Fpa Systems  Reporting Analyst Is Responsible For Executing And Mai,Financial Statements Data Management Financial Reporting Analytical Financial Planning Data Collection Data Integrity Forecasting
Fpa Analyst,Puma Energy,Mumbai,46 Yrs,3 Weeks Ago,Experience With Erp Systems And Reporting Tools Preferred  Strong Analytical And Nume,Financial Analysis Foreign Exchange Erp Analytical Forecasting Verbal Communication Business Analysis Accounting
Analyst,Uniqus,Chennai,02 Yrs,1 Day Ago,Flexibility And Willingness To Travel On Short Notice As Necessaryexperience Of Workin,Management Associate Financial Statements Financial Reporting Accounting Analytical Consulting Management Research
Fpa Analyst,Hempel,Pune,25 Yrs,1 Day Ago,Are You A Finance Professional Who Thrives On Turning Complex Data Into Actionable In,Procurement Erp Sap Financial Reporting Financial Analysis Budgeting Forecasting Analytics
Analyst,Urbanpiper,Bengaluru,13 Yrs,3 Weeks Ago,Mba  Post Graduates In Hr  Financeanalytics Or Related Fields  Or Bachelors In Eng,Settlements Hrms Hlookup Macros Data Analytics Law Data Analysis Mis Reporting
Mis Executive,Nibav Home Elevators,Chennai,15 Yrs,1 Day Ago,Required Skills  Strong Proficiency In Sql For Data Extraction Manipulation And Anal,Data Analysis Automation Business Reporting Analytical Power Bi Advanced Excel Data Visualization Microsoft
Analyst,Crisil,Mumbai Pune,01 Yrs,5 Days Ago,The Successful Candidate Should Have A Minimum Of 1 Year Of Experience In Credit Financ,Data Analysis Financial Reporting Bloomberg Financial Analysis Analytical Credit Analysis Financial Statement Analysis Financial Modelling
Analyst,Crisil,Pune,25 Yrs,5 Days Ago,Required Skills  Qualifications Competence In Reporting Tools And Dashboard Creation ,Capacity Management Administration Site Management Automation Process Improvement Data Integrity Operations Analytics
Analyst  Associate,Singhi Advisors,Mumbai New Delhi Bengaluru,12 Yrs,1 Week Ago,Mba  Pgdm Finance From Premier Institute Ca  Cfa With Articleship Experience From B,Due Diligence Financial Statements Networking Equity Research Mis Project Management Analytical Corporate Finance
Mis Executive,Rapidue Technologies,Hyderabad,36 Yrs,2 Days Ago,The Mis Executive Finance Is Responsible For Managing Financial Data Generating Repor,Financial Reporting Financial Planning Mis Reporting Financial Analysis Budgeting And Forecasting Strong Analytical Skills Financial Management Analysis
Mis  Executive,Balkrishna Industries Bkt,Mumbailower Parel,38 Yrs,2 Days Ago,Key Responsibilitiesprovide Detailed Reports To Management For Existing  New Client ,Sales Analysis Sales Mis Mis Operations Sales Analytics Mis Mis Preparation Mis Development Mis Reporting
Mis Analyst,Intouchcx,Hyderabad,35 Yrs,6 Days Ago,About The Jobthe Mis Analyst Is An Integral Role Within Global Service Desk And Is Resp,Sql Bi Tools Mis Data Analytics Vba Hlookup Bi Vlookup
Record To Report Ops Analyst,Accenture,Bengaluru,35 Yrs,6 Days Ago,Skill Required Record To Report  Intercompany Account Reconciliation,Service Operations Journal Entries Forecasting Reporting Analysis Record To Report Hlookup Macros Data Analysis
Offshore Ot Analyst,Leading Client,Hybrid  Mumbai Bengaluru,49 Yrs,1 Day Ago,A Degree In Industrial Engineering Instrumentation Engineering Or Be With Certification,Iec Siem Industrial Automation Ic Firewall Analytical Method Development Ftir Networking
Rr0205014 Nexthink Analyst Scb,Edata Systems,Bengaluru,24 Yrs,1 Day Ago,Build Understanding Of Business And Operational Strategies And Identify Critical Metric,Project Management Social Media Power Bi Data Quality Management Troubleshooting Powerpoint Operations
Mis Analyst,Improve Business Solutions,Hyderabadmadhapur,14 Yrs,1 Week Ago,Night Shifts  Male Candidates Only  Looking For A Candidate Who Has A Minimum Of 14,Vlookup Advanced Excel Mis Reporting Client Management Communication Skills Mis Operations Data Management Data Analysis
Record To Report Ops Analyst,Accenture,Navi Mumbai,35 Yrs,1 Week Ago,Qualifications Any Graduation Skill Required Reinsurance  Collections Processing  Y,Service Operations Vlookup Reinsurance Reporting Analysis Record To Report Hlookup Macros Data Analysis
Record To Report Ops Analyst,Accenture,Gurugram,35 Yrs,1 Week Ago,Skill Required Reinsurance  Life Insurance  Years Of Experience 3 To 5 Years  Abou,Service Operations Reinsurance Life Insurance Reporting Analysis Record To Report Hlookup Macros Data Analysis
Mis Executive,Spectrum Electrical Industries,Jalgaon Mumbai,15 Yrs,1 Week Ago,Maintain Bom Routing And Machine Master Data In Coordination With Engineering  Plann,Data Analysis Tools Report Preparation Advanced Excel Visualization Technologies Dashboards Report Automation Sap Data Interpretation
Mis Analyst,Vipul Organics,Mumbai Mumbai Suburban Mumbai All Areas,510 Yrs,1 Week Ago,Ensure The Integrity Accuracy And Maintenance Of All Factoryrelated Master Datarequi,Power Bi Google Apps Script Advanced Excel Data Analysis Dashboards Google Sheets Business Intelligence Vba Coding
Senior Analyst  Fpa,Reuters,Mumbai Hyderabad,26 Yrs,3 Weeks Ago,Shift Timings 2 Pm To 11 Pm Ist  Work From Office For 2 Days In A Weekmandatory ,Journal Entries Financial Reporting Networking Financial Analysis Business Analysis Cma Analytical Financial Planning
Analyst,Cheemas Oaktree Group,Hyderabad,15 Yrs,2 Weeks Ago,Flexible And Teamoriented With Strong Integrity And Professionalism Education  A Bac,Analytical Skills Communication Protocols Collateral Management Regulatory Reporting Xml Trade Settlements Reconciliation Hr
Analyst,Eclerx,Pune,02 Yrs,2 Weeks Ago,At Eclerx We Believe In Nurturing Talent And Providing Handson Experience  Eclerx F,Investment Banking Capital Market Derivatives Investment Banking Operations Fixed Income Settlements Trading Data Management
Analyst,Barclays,Chennai,08 Yrs,3 Weeks Ago,Experience In Financial Reporting Regulatory Reporting And Control Planning And  Or ,Sap Data Management Financial Reporting Senior Analyst Project Management Scrum Business Intelligence Continuous Improvement
Sra  Bfsi Sector Analyst,Crisil,Mumbai,36 Yrs,3 Weeks Ago,The Candidate Should Be Able To Build And Maintain Relationships With Investment Banks,Industry Research Bfsi Nbfc Senior Analyst Financial Analytics Report Writing Banking Research
Esg Analyst,Solaron Sustainability,Bengaluru,27 Yrs,3 Weeks Ago,Experience In Business  Industry Research And Exposure To Both Secondary And Primary R,Primary Research Industry Research Eye For Detail Research Analyst Working Company Analytical Skills Excellent Communication
Insights Analyst,Convegenius Edu,Bengaluru,49 Yrs,3 Weeks Ago,Minimum Qualifications  Experience Minimum 4 Years Sectors Preferred Of Experience I,Health Insurance Google Analytics Data Modeling Mis Analytical Egovernance Data Collection Business Intelligence
Asia Lec  Analyst,Jpmorgan Chase Bank,Bengaluru,010 Yrs,3 Weeks Ago,Bachelor S Degree In Accounting Finance Or Related Business Field Proficient Excel Sk,Financial Statements Financial Control Regulatory Reporting Financial Reporting Accounting Analytical Reconciliation Legal
Analyst,Center Study Science Technology Policy,Bengaluru,12 Yrs,3 Weeks Ago,The Candidate Must Be Wellversed In The Technical And Policy Aspects Of Climate Change,Project Development Data Analysis Literature Analytical Report Writing Research Ms Office Application Analyst
Fpa Analyst Ca,Tyasuite Software Solutions,Bengaluru,25 Yrs,3 Weeks Ago, Ca With 25 Years Of Experience In Fpa Business Finance Within It Industry Proficie,Data Management Financial Reporting Financial Analysis Business Finance Analytical Advanced Excel Data Visualization Forecasting
Fpa Og Decomissioning Analyst,Bp Incorporate International,Pune,510 Yrs,3 Weeks Ago,The Incumbent Would Be Potentially Required To Work Under Alternative Shift Arrangement,Sap Financial Reporting Financial Analysis Financial Planning Business Planning Cost Estimation Forecasting Operations
Analyst,Inspira Enterprise India,Mumbai Nagpur Thane Nashik Pune Aurangabad,02 Yrs,3 Weeks Ago,Database Activity Monitoring  L1 Job Description Job Responsibility Pla,Report Generation Linux Security Management Soc Analytical Database Security Database Archiving
Principal Analyst  Fpa,Anheuser Busch Inbev,Bengaluru,46 Yrs,3 Weeks Ago,Reporting And Analysis  Custodian And Driver Of Variable Logistics Costs  Zbb For Be,Procurement Supply Chain Erp Data Management Cognos Mis Ms Office Project Delivery
Analyst  Internal Reporting,Barclays,Noida Chennai,09 Yrs,1 Day Ago,Join Us As Financial Control Analyst At Barclays Where Youll Spearhead The Evolution ,Analyst Sap Data Management Financial Reporting Project Management Scrum Business Intelligence Continuous Improvement
Record To Report Ops Analyst,Accenture,Bengaluru,35 Yrs,1 Day Ago,Qualifications Bcom  Any Graduation Skill Required Record To Report  Account Reconc,Accounts Reconciliation Python Sql Stakeholder Management Record To Report Data Analytics Data Management Service Operations
Bx Reporting Coe  Analyst,Barclays,Chennai,09 Yrs,1 Day Ago,Join Barclays As A Bx Reporting Coe  Analyst Role Where To Provide Data Governance Ex,Analyst Analytical Finance Service Excellence Data Governance Financial Risk Management Continuous Improvement Operations
Mis Executive,Super Scholar,Noida,13 Yrs,1 Day Ago,Skills  Qualifications  Musthave Bachelors Degree In Business Administration Infor,Data Analysis Erp Operational Excellence Analytical Budgeting Business Intelligence Forecasting Operations
Reporting Analyst I,Mr Cooper Group,Chennai,12 Yrs,1 Day Ago,Preferred Skills Knowledge Of Statistical Tools And Techniques Qualifications 12 Ye,Data Analysis Excel Reporting Analyst Analytical Data Collection Data Visualization Business Intelligence Reporting Tools
Mis Executive,Super Scholar,Bengaluru,15 Yrs,1 Day Ago,Bachelor S Degree In Business Administration Commerce Finance Or A Related Field Pr,Data Analysis Erp Sap Operational Excellence Data Management Analytical Budgeting Oracle
Qualtrics Analyst,Strada,Hyderabad Gurugram,38 Yrs,5 Days Ago,Our Team S Experience In Human Insights And Cloud Technology Gives Companies And Employ,Text Mining Training Payroll Application Support Diversity And Inclusion Manager Technology Management Continuous Improvement
Deal Desk Analyst,Vonage Business Communication,Bengaluru,510 Yrs,4 Days Ago,Required  Bachelors Degree In Business Economics Finance Or Accounting  5 Years I,Sales Analytical Cloud Customer Engagement Stakeholder Management Operations Digital Transformation Monitoring
Hplc Analyst,Arbro Pharmaceuticals,Bahadurgarh,26 Yrs,4 Days Ago,Must Have Worked Analytical Lab  2 Knowledge Of Hplc  Knowledge Of Caliberation An,Hplc Fg Uv Chemical Analysis Ir High Performance Liquid Chromatography Wet Analysis Analytical Chemistry
Deal Desk Analyst,Autorabit,Hyderabad,23 Yrs,5 Days Ago,Work Timings Pst Hours Night Shift Deep Understanding Of Saas And Subscription Pricin,Analytical Skills Metadata Sales Version Control Senior Analyst Analytical Saas Salesforcecom
Sr Fpa Analyst,Snow Planet,Hyderabad,27 Yrs,6 Days Ago,The Preferred Candidate Will Have Experience Partnering With Crossfunctional Teams And,Opex Operational Excellence Senior Financial Analyst Analytical Financial Planning Power Bi Forecasting Operations
Privacy Analyst,Reuters,Bengaluru,25 Yrs,6 Days Ago,Bachelor S Degree In Law Information Technology Business Or A Related Fieldmake An I,General Counsel Career Development Hp Data Protector Senior Analyst Analytical Consulting Data Privacy Taxation
Analyst,Merkle Science,Pune,12 Yrs,5 Days Ago,The Purpose Of This Role Is To Provide Support For The Collection Analysis And Dissem,Analyst Data Science Analytics Data Science Analysis
Analyst,Merkle B2B,Pune,02 Yrs,5 Days Ago,Time Type Full Time,Financial Analysis Python Data Analysis Data Analytics Natural Language Processing Investment Banking Business Analysis Analysis
Analyst  Immunization,Clinton Health Access Initiative Chai,Bhagalpur Muzaffarpur Patna Gaya,27 Yrs,6 Days Ago,The Clinton Health Access Initiative Inc Chai Is A Global Health Organization Commi,Supply Chain Computer Science Pharma Analytical Project Management Consulting Healthcare Analytics
Analyst,Center Study Science Technology Policy,Bengaluru,27 Yrs,6 Days Ago, Masters Or Bachelors Degree In Engineering,Economics Chemical Literature Simulation Analytical Mechanical Data Collection Application Analyst
Record To Report Ops Specialist,Accenture,Gurugram,712 Yrs,1 Week Ago,Skill Required Record To Report  Account Reconciliationsbecause The Reconciliation Ac,Accounts Reconciliation Project Management Accounting Reporting And Analytics Record To Report Financial Analysis Data Management Forecasting
Mis Executive,Club Oxygen,Kochi Mumbai Chandigarh New Delhi Lucknow Thrissur Chennai Ahmedabad Jaipur Bengaluru,12 Yrs,3 Weeks Ago,Skills Required Proficient In Ms Office  Especially  Excel Good Analytical  Communi,Vice President Marketing Report Generation Data Analysis Excel System Maintenance Mis Analytical Management
Mis Executive,Club Oxygen,Kochi Mumbai Chandigarh New Delhi Lucknow Thrissur Chennai Ahmedabad Jaipur Bengaluru,12 Yrs,3 Weeks Ago,Skills Required Proficient In Ms Office  Especially  Excel Good Analytical Communica,Vice President Marketing Report Generation Data Analysis System Maintenance Mis Analytical Management Ms Office
Mis Executive,Paranjape Schemes Construction,Puneprabhat Road,25 Yrs,3 Weeks Ago,Preferred Candidate Profile   Bachelors Degree In Marketing Communications Business,Sales Analysis Mis Preparation Sales Mis Mis Operations Mis Reporting Sales Review Monthly Reports Sales Report
Research Analyst,Ab,Pune,27 Yrs,3 Weeks Ago,Excellent Financial Analysis And Modeling Skills Strong Quantitative Background Excell,Industry Research Data Validation Financial Reporting Asset Liability Management Financial Analysis Investment Portfolio Analytical Investment Management
Iss Mi Analyst Research Production Services,Iss Corporate Solutions,Mumbai,12 Yrs,3 Weeks Ago,Candidates Should Have  An Undergraduate Or Graduate Degree From A Wellrecognized Un,Automation Data Management Wealth Management Senior Analyst Mutual Funds Analytical Data Collection Forecasting
Record To Report Ops Analyst,Accenture,Gurugram,37 Yrs,2 Weeks Ago,Skill Required Record To Report  Intercompany Account Reconciliation,Service Operations Vlookup Reporting Analysis Record To Report Financial Reporting Hlookup Macros Data Analysis
Mis Analyst,Intouchcx,Hyderabad,35 Yrs,2 Weeks Ago,About The Jobthe Mis Analyst Is An Integral Role Within Global Service Desk And Is Resp,Mis Hlookup Bi Vlookup Dashboards Business Intelligence Sql Bi Tools
Mis Executive,Tn Business Services,Gurugram,14 Yrs,3 Weeks Ago, Should Be Able To Work Under Pressure And Be Able To Manage The Team Conduct Data And,Payroll Processing Data Validation Excel Sales Analytical Conditional Formatting Metrics Analysis Management Reporting
Mis Analyst,Rudra Anlytics,Pune,16 Yrs,3 Weeks Ago,Qualification Masters In Human Resources Management Experience Required 1 Years Cand,Mis Reporting Visual Basic Data Collection Advanced Excel Management Macros Operations Mis Analyst
Mis Executive,Aryan Imaging  Business Consultants,Pune Pune,34 Yrs,3 Weeks Ago,Position Objectives To Maintain All Data Related To The Process To Capture And Ana,Data Base Process Data Analysis Analytical Circulation Outlook Maintaining Reporting
Research Analyst,Immverse,Nagpur,03 Yrs,3 Weeks Ago,Bachelor S  Master S Degree In Business Finance Data Science Or A Related Field Goo,Automation Excel Analytical Report Writing Machine Learning Power Bi Data Analytics Data Visualization
Reporting Analyst,Fusion Plus Solutions,Hyderabad,24 Yrs,3 Weeks Ago, Job Summary We Are Seeking A Skilled Reporting Analyst With Experience In Alteryx To,Hlookup Macros Data Analysis Data Analytics Mis Reporting Data Validation Power Bi Pivot Table
Mis Executive,Topline Industries,Patna,12 Yrs,3 Weeks Ago,Experience  Well Versed In Advanced Ms Excel Knowledge Of Vlookup Pivot And Shortcu,Report Generation Data Analysis System Maintenance Mis Vlookup Analytical Management Accounting Software
Mis Executive,1Point1,Mumbai,03 Yrs,3 Weeks Ago,Excellent Analytical  Good Knowledge Of The Web Applications And Their Functioning In,Mis Reporting Data Analysis Excel Team Management Mis Process Improvement Analytical Internet Searching
Research Analyst,Lh Technocom,Udaipur,13 Yrs,3 Weeks Ago,Manage Data As Per Clientspecific Requirement While At The Same Time Adhering To Morn,Data Analysis Project Reports Manager Quality Assurance Excel Data Management Analytical Cash Flow Statement Continuous Improvement
Mis Executive Position,Pioneer E Solutions,Gurugram,23 Yrs,3 Weeks Ago,Develop And Maintain Daily Weekly And Monthly Mis Data Create And Maintain Daily Op,Data Analysis Data Validation System Maintenance Mis Vlookup Analytical Conditional Formatting Microsoft
Mis Executive,1Point1,Mumbai,58 Yrs,3 Weeks Ago,Excellent Analytical  Good Knowledge Of The Web Applications And Their Functioning In,Mis Reporting Data Analysis Excel Team Management Mis Process Improvement Analytical Internet Searching
Research Analyst,Esg Risk Assessments  Insights,Mumbai,13 Yrs,3 Weeks Ago,The Candidate Should Have A Fair Understanding Of The Economic  Financial Factors Affe,Health Insurance Interpersonal Skills Quantitative Research Analytical Report Writing Trend Analysis Financial Analyst Research
Mis Executive  Thane,Homesfy,Thane,45 Yrs,3 Weeks Ago,Last Year We Grew By More Than 400 Motivated Team Members And Homesfy Has Been The Pr,Business Administration Nse Report Generation Data Analysis Excel Mis Analytical Data Integrity
Analyst  Economic Research,Gd Research Center Gdrc,Hyderabad,13 Yrs,3 Weeks Ago,Expertise In Usage Of Databases Like Ceic  Haver  Bloomberg  Reuters Should Be Invol,Analytical Skills Excel Bloomberg Senior Analyst Report Writing Healthcare Economic Research Research
Mis Executive,Loom Solar,Palwal,14 Yrs,3 Weeks Ago,Bachelors Degree In Commerce It Or A Related Field,Mis Reporting Data Analysis Excel Vlookup Analytical Commerce Management Reporting Tools
Mis Executive,Rd Trinitas,Pune,16 Yrs,3 Weeks Ago,Proficient In Preparing And Managing Daily Weekly And Monthly Mis Reports And Dashboa,Analytical Skills Mis Reporting Sub Excel Sales Trend Analysis Management Operations
Mis Executive,Maynor Consulting,Noida,38 Yrs,3 Weeks Ago,About The Role We Are Looking For A Skilled And Proactive Mis Executive With Str,Computer Science Data Analysis Sap Mis Workflow Oracle Business Intelligence Information Technology
Inventory Audit And Mis Analyst,Medanta,Gurugram,13 Yrs,3 Weeks Ago,Bachelor S Degree In Any Fieldproven Experience In Data Analysis Auditing And Mis Rep,Mis Reporting Procurement Data Analysis Supply Chain Management Erp Sap Analytical Risk Management
Research Analyst,Cc Commodity Info Services Llp,Mumbai Mumbai,27 Yrs,3 Weeks Ago,The Job Involves Research And Analysis Of Commodity Markets Spot And Futures As Well ,Domestic Reports Markets Research And Analysis Analytical Research Analyst Futures Commodity Markets
Sql Report Writer  Analyst,Iprime Services,Noida,23 Yrs,3 Weeks Ago, Must Be Able To Develop Complex Views And Stored Procedures  Research Required Datap,Data Analysis Business Objects Pdf Aviation Mis Analytical Cognos Trend Analysis
Mis Executive,Global Education,Mumbai,03 Yrs,3 Weeks Ago,Education Criteria  Any Graduate  Post Graduate,Report Generation Data Analysis Customer Management System Maintenance Mis Analytical Management Operations
Mis Executive,Aryan Imaging  Business Consultants,Pune,24 Yrs,3 Weeks Ago,Qualification Graduate,Te Process Data Analysis Analytical Circulation Data Se Reporting Coordination
Hiring For Presentation Analyst In Noida,Shadow Placements,Hybrid  Noida New Delhi Gurugram,27 Yrs,3 Weeks Ago,This Is Not A Business  Data Analyst Role Minimum 3 Years Exp In A Similar Role Excell,Presentation Analyst Powerpoint Excel Business Development Insights Business Analytics Tableau Reporting
Data Scientist,Leading Client,Hyderabad,510 Yrs,1 Day Ago,More Than 5 Years Of Experience Working In Power Bi Developement Projects Hands On Exp,Bi Power Bi Power Query Report Builder Dax Python Data Analysis Data Analytics
Gfcc Detectreport Specialist,Jpmorgan Chase Bank,Hyderabad,410 Yrs,1 Day Ago,Qualified Graduate With Minimum Of 4 Years Of Relevant Experience In Global Financial C,Analytical Skills Data Analysis Quality Improvement Quality Standards Compliance Anti Money Laundering Investigation Management
Gfcc Detectreport Specialist,Jpmorgan Chase Bank,Hyderabad,26 Yrs,1 Day Ago,Qualified Graduate With 2 To 6 Years Of Relevant Experience In Global Financial Crime C,Analytical Skills Data Analysis Quality Improvement Quality Standards Compliance Finance Anti Money Laundering Investigation
Gfcc Detectreport Specialist,Jpmorgan Chase Bank,Hyderabad,37 Yrs,1 Day Ago,Qualified Graduate With Minimum Of 4 Years Of Relevant Experience In Global Financial C,Analytical Skills Data Analysis Quality Improvement Quality Standards Compliance Anti Money Laundering Investigation Management
Reporting Gen Ai Developer,Pepsico,Hyderabad,79 Yrs,1 Day Ago,Consult With The Data  Analytics Team And Reporting Factory Developers To Build The Re,Python Artificial Intelligence Sql Tensorflow Pytorch Data Analysis Data Analytics Natural Language Processing
