job_title,company,location,experience,posted,description,skills
Mis Executive,Mirrow Trade,Surat,13 Yrs,3 Weeks Ago,Ompax Lifestyle Private Limited Is Looking For Mis Executive To Join Our Dynamic Team A,Hlookup Conditional Formatting Charts Macros Data Analysis Sumif Mis Reporting Data Validation
Research Analyst,Geltec,Mumbai,12 Yrs,3 Weeks Ago,Geltec Is Looking For Research Analyst To Join Our Dynamic Team And Embark On A Rewardi,Data Analysis Research Analysis Market Research Analysis Data Collection Research Sales Market Analysis
Research Analyst,Nectarwise Market Research,Pune,13 Yrs,3 Weeks Ago,Nectarwise Market Research Is Looking For Research Analyst To Join Our Dynamic Team And,Data Analysis Research Analysis Market Research Analysis Data Collection Research Sales Market Analysis
Mis Executive,Primohunt Corporate,Ahmedabad,04 Yrs,3 Weeks Ago,Knowledge Of Tally And Ms Excel Is A Must Coordinate With Team Members To Gather Data ,Mis Reporting Tally Management Information System Data Analysis Excel Sales Vlookup Executive Management
Mis Executive,Couponorg Digital Media,Gurugram,03 Yrs,3 Weeks Ago,Sound Knowledge  Hands On Experience On Hlook Up Vlook Up Pivot Table Conditional,Hlookup Conditional Formatting Charts Macros Data Analysis Sumif Mis Reporting Data Validation
Mis Executive,Corporate Incentive Solutions,Chandigarh,01 Yrs,3 Weeks Ago,Sound Knowledge  Hands On Experience On Hlook Up Vlook Up Pivot Table Conditional,Hlookup Conditional Formatting Charts Macros Data Analysis Sumif Mis Reporting Data Validation
Research Analyst,Moral Financial Research,Raipur,13 Yrs,3 Weeks Ago,Vashisthya Research And Education Foundation Is Looking For Research Analyst To Join Ou,Data Analysis Research Analysis Market Research Analysis Data Collection Research Sales Market Analysis
Research Analyst,Ratnabali Capital Markets Limited Rcml,Kolkata,01 Yrs,3 Weeks Ago,Skills Required 1 Smart Person With Ability To Think Clearly And Logically 2 Good W,Financial Analysis Data Analysis Equity Research Investment Banking Research Analysis Business Analysis Financial Research Market Research
Research Analyst,Stellar Market Research,Pune,02 Yrs,3 Weeks Ago,Stellar Market Research Pvt Ltd Is Looking For Research Analyst To Join Our Dynamic Tea,Data Analysis Research Analysis Market Research Analysis Data Collection Research Sales Market Analysis
Research Analyst,Flyways Softwares And Solutions,Kanyakumari,02 Yrs,3 Weeks Ago,Flyways Softwares And Solutions Is Looking For Research Analyst To Join Our Dynamic Tea,Data Analysis Research Analysis Market Research Analysis Data Collection Research Sales Market Analysis
Research Analyst,Celestis Pharmaceuticals,Ahmedabad,14 Yrs,3 Weeks Ago,Celestis Pharmaceuticals Is Looking For Research Analyst To Join Our Dynamic Team And E,Pharmaceutical Data Analysis Research Analysis Market Research Analysis Data Collection Research Sales
Mis Executive,Triveni Chemicals,Valsad,02 Yrs,3 Weeks Ago,Triveni Chemicals Is Looking For Mis Executive To Join Our Dynamic Team And Embark On A,Hlookup Conditional Formatting Data Analysis Sumif Mis Reporting Data Validation Pivot Table Data Warehousing
Mis Executive,Chennais Amirta International Institute Of Hotel Management,Chennai,26 Yrs,3 Weeks Ago,Chennais Amirta International Institute Is Looking For Mis Executive To Join Our Dynami,Hlookup Conditional Formatting Charts Macros Data Analysis Sumif Mis Reporting Data Validation
Mis Executive,Augtech Nextwealth It Services,Bhilai,13 Yrs,3 Weeks Ago,Candidate Must Understand Operational Process Logical Thinking  Ability To Work On Da,Mining Mis Reporting Data Analysis Data Processing Mining Operations Mis Preparation Research Ms Office
Mis Executive,Aryan Imaging  Business Consultants,Pune,34 Yrs,3 Weeks Ago,Position Objectives To Maintain All Data Related To The Process To Capture And Analyze,Process Data Analysis Mis Executive Circulation Data Se Reporting Coordination Follow Ups
Research Analyst,Analytical Market Research,Pune,25 Yrs,2 Weeks Ago,Analytical Market Research Is Looking For Research Analyst To Join Our Dynamic Team And,Data Analysis Research Analysis Market Research Analysis Data Collection Research Sales Market Analysis
Genome Analyst,Lilac Insights,Latur,25 Yrs,2 Weeks Ago,The Ideal Candidate Will Be Responsible For The Interpretation Preparation And Review,Clinical Genomics Molecular Biology Ngs Report Interpretation Documentation Genome Analyst Ngs Workflows Genomics Reporting
Genome Analyst,Lilac Insights,Pune,25 Yrs,2 Weeks Ago,The Ideal Candidate Will Be Responsible For The Interpretation Preparation And Review,Clinical Genomics Molecular Biology Ngs Report Interpretation Documentation Genome Analyst Ngs Workflows Genomics Reporting
Genome Analyst,Lilac Insights,Navi Mumbai,25 Yrs,2 Weeks Ago,The Ideal Candidate Will Be Responsible For The Interpretation Preparation And Review,Clinical Genomics Molecular Biology Ngs Report Interpretation Documentation Genome Analyst Ngs Workflows Biology Reporting
Genome Analyst,Lilac Insights,Mumbai,25 Yrs,2 Weeks Ago,The Ideal Candidate Will Be Responsible For The Interpretation Preparation And Review,Clinical Genomics Molecular Biology Ngs Report Interpretation Documentation Genome Analyst Ngs Workflows Biology Reporting
Genome Analyst,Lilac Insights,Mumbai Suburban,25 Yrs,2 Weeks Ago,The Ideal Candidate Will Be Responsible For The Interpretation Preparation And Review,Clinical Genomics Molecular Biology Ngs Report Interpretation Documentation Genome Analyst Ngs Workflows Workflow Analysis Biology
Mis  Coordinatorho  Supportpos Point Of Sale,Kotak Life Insurance,Mumbai,14 Yrs,1 Day Ago,Automation Of Mis  Job Requirements  Graduate With 1 Or 2 Years Of Experience Good W,Data Analysis Pivot Table Vlookup Mis Advanced Excel Hlookup Conditional Formatting Macros
Mis  Coordinatorbranch Bankingbranch Banking,Kotak Life Insurance,Mumbai,14 Yrs,1 Day Ago,Graduate With 1 Or 2 Years Of Experience Strong Data Understanding And Ability To Work,Data Analysis Pivot Table Vlookup Mis Advanced Excel Hlookup Conditional Formatting Macros
Record To Report Ops Specialist,Accenture,Noida,711 Yrs,1 Day Ago,Skill Required Record To Report  Account Reconciliationsbecause The Reconciliation Ac,Accounts Reconciliation Forecasting Accounting Record To Report Finance Financial Analysis Accounts Receivable Accounts Payable
Record To Report Ops Specialist,Accenture,Bengaluru,711 Yrs,1 Day Ago,Skill Required Record To Report  Financial Consolidation  Close Operations,Forecasting Accounting Budgeting Record To Report Finance Financial Analysis Accounts Receivable Accounts Payable
Research Associate,Infiniti Research,Bengaluru,01 Yrs,1 Day Ago,Experience 03 Months Internship Experience Preferred Minimum 3Month Internship Pref,Secondary Research Market Sizing Swot Analysis Primary Research Industry Research Research Qualitative Research Quantitative Research
Mis Specialist,Futuresoft India,Hybrid  Bengaluru,36 Yrs,1 Day Ago,Overall Should Be Mis Expertise With Deployment Exposure Is A Plusexperience  35 Yrs,Mis Preparation Mis Operations Advanced Excel Deployment Process Stakeholder Management Mis Generation Mis Reporting Reporting
Developer  L4,Wipro,Hyderabad,58 Yrs,2 Days Ago,Ensure Good Quality Of Interaction With Customer Wrtexperience 58 Years,Cc Continuous Integration Root Cause Analysis Software Development Life Cycle Mis Software Development Software Testing Test Cases
Research Analyst,Fair Finance,Kolkata Mumbai New Delhi Hyderabad Pune Chennai Bengaluru,02 Yrs,5 Days Ago,Fair Finance Is Looking For Research Analyst To Join Our Dynamic Team And Embark On A R,Research Analyst Research Research Analysis Analysis
Mis Executive,Club Oxygen,Chennai Ahmedabad Bengaluru,12 Yrs,6 Days Ago,Skills Required Proficient In Ms Office  Especially  Excel Good Analytical  Communi,Mis System Maintenance Hlookup Data Analysis Documentation Vlookup Data Maintenance
Mis Executive,Hinduja Leyland Finance,Chennai,13 Yrs,5 Days Ago,Strong Communication Skill Is Required Must Have Hands On Experience In Advanced Excel,Mis Preparation Excel Report Preparation Coordination Mis Operations Mis Updation Documentation Backend Operations Mis Reporting
Mis Executive,Fmcg Sector,Navi Mumbai Virar Mumbai All Areasvasai 1,14 Yrs,1 Day Ago,Handling Database Management By Using Advanced Excel Tools Should Be Proficient With Ad,Advanced Excel Vba Vlookup Conditional Formatting Pivot Countif Formulas Charts
Mis Executive,Dh Secheron,Navi Mumbai,25 Yrs,1 Day Ago,Hiring Mis Executive With Strong Excel Skills Responsibilities Prepare And Update Dai,Mis Reporting Excel Daily Reports Coordination Mis Operations Conditional Formatting Formulas Advanced Excel
Mis Executive,Huntmatic Global,Chandigarhsector 39,01 Yrs,1 Day Ago,Female Candidates Only Must Have Basic Knowledge Of Ms Excel Formulas Like  Sum Ave,Advanced Excel Mis Mis Reporting Reporting Excel
Mis Executive,Natcure Biotech,Raipur,13 Yrs,1 Day Ago, Organize And Manage Both Digital And Physical Records To Optimize Access Assist In ,Advanced Excel Excel Sheet Excel Report Preparation Pivot Table Vlookup Mis Operations Formulas Excel
Mis Executiveahmedabad,Fmcg Sector,Ahmedabadshilaj 1,01 Yrs,1 Day Ago,Prepare And Submit All Report To Ho On Time For Rt Deptcash  Stock Management In The ,Advance Excel Pivot Table Sumif Countif Vlookup Formulas Conditional Formatting Charts
Mis Executive,Nobleagro Food Products,Ahmedabad,34 Yrs,2 Days Ago,Create Custom Web Applications Dashboards And User Interfaces Using Html Css And Ja,Css Google Apps Script Html Google Workspace Javascript Google Sheets Performance Optimization Data Analysis
Mis Executive,Profound Human Resource Development Advisors,Kolkata,27 Yrs,2 Days Ago,Role  Responsibilities Job Summary The Mis Executive Will Be Responsible For Develop,Power Bi Reports Power Bi Dashboards Advanced Excel Dashboards Reporting Excel Bi Birt
Mis Executive,2Coms,Kolkata,16 Yrs,2 Days Ago,Requirements  Graduate In Bcom  Mba Finance Preferred  1 3 Years Of Experience In ,Charts Tds Formulas Vlookup Accounting Dashboards Tables Operations
Research Analyst,Crisil,Mumbai,69 Yrs,4 Days Ago,Work With Team Of Onshore Analysts To Cover Lev Fin Credit Portfolio ,Team Management Financial Analysis Underwriting Financial Risk Workflow Financial Statement Analysis Credit Analysis Stakeholder Management
Research Analyst,Crisil,Mumbai,12 Yrs,4 Days Ago,Work With Team Of Onshore Analysts To Cover Lev Fin Credit Portfolio ,Financial Analysis Financial Risk Workflow Credit Risk Management Credit Risk Analysis Credit Analysis Financial Statement Analysis Credit Assessment
Mis Executiveinternational,Teleperformance Tp,Mumbai,18 Yrs,4 Days Ago,Business Intelligence Bi Data Analysis Work Includes Analyzing Business Intellige,Data Analysis Mis Customer Experience Management Customer Service Business Intelligence Individual Contributor Operations Monitoring
Mis Executive,Teleperformance Tp,Jaipur,12 Yrs,4 Days Ago,Has A Knowledge Base Typically Acquired From A Professional  University Degree And App,Data Analysis Customer Experience Management Customer Service Business Intelligence Operations Monitoring Logistics Mis Executive
Executive  Mis,Teleperformance Tp,Gurugram,12 Yrs,4 Days Ago,Has A Knowledge Base Typically Acquired From A Professional  University Degree And App,Data Analysis Customer Experience Management Customer Service Business Intelligence Operations Monitoring Logistics Mis Executive
Mis Executive,Savvi Sales  Services,Panipat,34 Yrs,4 Days Ago,Location Panipat Full Time Part Time Full Time Department Management Qualificati,Mis Operations Vlookup Conditional Formatting Advanced Excel Pivot Hlookup Excel Report Preparation Report Preparation
Mis Executive,Bigbasket,Bengalurusoukya Road 1,16 Yrs,4 Days Ago,Key Responsibilitiescollect Collate And Analyze Data From Various Sources Prepare ,Advanced Excel Mis Preparation Countif Formulas Mis Reporting Hlookup Excel Report Preparation Pivot Table
Mis Executive  L2,Wipro,Pune,13 Yrs,5 Days Ago,Prepare Timely And Accurate Mis Reports And Dashboards As Required By The Stakeholders ,Data Management Dashboards Data Reporting Mis Mis Development Hlookup Conditional Formatting Macros
Mis Executive,Circolife,Thane,13 Yrs,5 Days Ago,Mis  Operationsmaintain And Update Daily Customer Onboarding Trackers In Excelgoogle ,Mis Operations Advanced Excel Mis Reporting Reporting Operations Mis Excel
Research Analyst,Crisil,Mumbai,12 Yrs,5 Days Ago,Work With Team Of Onshore Analysts To Cover Lev Fin Credit Portfolio Prepare Quarterl,Financial Analysis Analysts Credit Underwriting Workflow Credit Analysis Research Analysis Financial Statement Analysis Analysis
Research Analyst,Crisil,Mumbai Singapore,69 Yrs,5 Days Ago,Work With Team Of Onshore Analysts To Cover Lev Fin Credit Portfolio Prepare Quarterl,Financial Analysis Credit Underwriting Workflow Credit Analysis Research Analysis Financial Statement Analysis Analysis Monitoring
Mis Executive,Jones Lang Lasalle Property Consultants India Pv T Ltd,Bengaluru,23 Yrs,6 Days Ago,Being Analytical And Meticulous  You Must Pay Attention To Detail And Have Excellent A,Accounting Recruitment Financial Management Mis Daily Reports Hlookup Conditional Formatting Sumif
Record To Report Ops Analyst,Accenture,Mumbai,35 Yrs,6 Days Ago,Qualifications Any Graduation Skill Required Record To Report  Financial Consolidati,Vlookup Accounting Alteryx Tableau Uipath Balance Sheet Macros Data Analysis
Record To Report Ops Analyst,Accenture,Gurugram,35 Yrs,6 Days Ago,Skill Required Record To Report  Financial Consolidation  Close Operationsthey Also ,Journal Entries Accounting Extract Transform Load Record To Report Etl Service Operations Informatica Powercenter Forecasting
Record To Report Ops Analyst,Accenture,Gurugram,35 Yrs,6 Days Ago,Skill Required Record To Report  Balance Sheet Account Reconciliations,Balance Sheet Journal Entries Accounting General Ledger Record To Report Financial Analysis Service Operations Forecasting
Record To Report Ops Analyst,Accenture,Bengaluru,35 Yrs,6 Days Ago,Qualifications Any Graduation Skill Required Record To Report  Account Reconciliatio,Accounts Reconciliation Journal Entries Accounting General Ledger Record To Report Hlookup Macros Service Operations
Mis Executive,Rkv Cargo Movers,Hosur,26 Yrs,6 Days Ago,Roles And Responsibilitiesprepare Monthly Sales Reports Using Advanced Excel Skills In,Mis Preparation Pivot Dashboard Development Mis Reporting Vlookup Advanced Excel Reporting Development
Mis Executive36Pune,Mangalam Placements Pvt Ltd,Pune,36 Yrs,6 Days Ago,Role  Mis Executivelocation  Pune Experience  3 To 6 Yearsqualification  Bcomjob ,Mis Preparation Mis Operations Mis Mis Generation Mis Reporting Reporting Operations Generation
Mis Executive,Otsuka Pharmaceutical India Pvt Ltd,Ahmedabad,23 Yrs,6 Days Ago,Preferred Candidate Profile  1 Knowledge Of Microsoft Excel  Mis Management  2 Da,Analysis Advanced Excel Powerpoint Power Bi Bi Excel Mis
Research Analyst,Zigram,Hybrid  Gurugram,01 Yrs,1 Week Ago,Role  Responsibilities Highly Focused Individual With Selfdriven Attitudeperform Qual,Excel Secondary Research Research Communication Skills Qualitative Research Primary Research Quantitative Research Secondary
Cashier Cum Mis Executive,Wheels Scaffolding,Mohali,37 Yrs,2 Days Ago,Position Cashier Cum Mis Executive Experience1 To 3 Yearsqualification B Com Mandat,Cash Handling Mis Reporting Reconciliation Cash Mis Reporting Cashier Activities Handling
Mis Executive,Manpower Group Services India,Visakhapatnam,15 Yrs,5 Days Ago,Position  Mis Executive Qualification  Bachelors Degree Immediate Requirement For M,Pivot Table Report Generation Mis Vlookup Advanced Excel Conditional Formatting Formulas Data Processing
Rtr  R2R  Record To Report  Analystconsultantmanager,Top B2B Corporate Management Consulting Firm,Hyderabad Bangalore Rural Bengaluru,611 Yrs,5 Days Ago,Degree Requirement Certified Ca  Cpacma Etc Preferredopen To Other Candidates With,Rtr Month End Reporting Record To Report Balance Sheet Reconciliation Journal Entries Month End Closing R2R Intercompany Accounting
Research Analyst,Crisil,Mumbai Pune,12 Yrs,5 Days Ago,Good With Excel  Review Daily Cash Reconciliations Prepared By Operations Between Prim,Automation Operations Research Financial Analysis Accounting Banking Operations Reconciliation Workflow Data Integrity
Analyst External Reporting Analyst External Reporting,Jpmorgan Chase Bank,Bengaluru,15 Yrs,5 Days Ago,Bachelor S Degree In Accounting Finance Or A Related Disciplinerequired Qualification,Automation Data Validation Us Gaap Data Management Financial Reporting Corporate Finance Visio Ms Office
Mis Executive,Kumaran Systems,Chennaisiruseri Sipcot It Park,25 Yrs,6 Days Ago,Collaborate With Crossfunctional Teams To Gather Requirements And Deliver Highquality,Excel Mis Advanced Excel Mis Reporting Pivot Table Vba Vlookup Hlookup
Pms Analyst,Jibe Development Services,Navi Mumbai Chennaianna Salai,35 Yrs,1 Week Ago,Contribute In Training To Internal  External Jibe Users On Pms And Related Modules Whe,Ms Excel 2Nd Engineer Pms Data Building Marine Engineer 3Rd Engineer Vessel Spare Parts Expreaction Pms Vessel Microsoft
Analyst,Swaniti,Kolkata Mumbai New Delhi Hyderabad Pune Chennai Bengaluru,712 Yrs,1 Week Ago,Prior Experience Of Working With Government Multilaterals Of Recognized Csos Will Be P,Supply Chain Data Analysis C Senior Analyst Focus Research Management Programme Implementation
Hiringgraphic Designer Animatedstatic  Analyst,Big4,Mumbai Suburban Navi Mumbai Mumbai All Areas,46 Yrs,1 Week Ago,Flexible To Work In Shifts Google S Double Click Campaign Management Certification Pos,Static And Animated Content Creation Adobe Creative Suite Adobe Photoshop Css Storyboards Knowledge Of Jsjavascript Coding Google Web Designer Html5
Tolerance Stackup Analystdva,Pi Square Technologies,Bengaluru,38 Yrs,1 Week Ago,Preferred 4 Years 7 Years Of Experience With Stackup Analysis Minimum 2 Years Of Expe,Dimensional Variation Analysis Stackup Analysis Teamcenter Tolerance Gdt T Dvp Analysis
Deal Desk Analyst,Cognizant,Bengaluru,13 Yrs,1 Week Ago,This Is A Permanent Night Shift Position Willingness To Work Permanently In The Night ,Deal Desk Pricing Pricing Strategy Desk Analysis
Date Analyst  Unpaid ,Saveo,Bengaluru,02 Yrs,1 Week Ago,Bachelors Degree Program In Finance Accounting Business Or A Related Field Check S,Date Analysis Risk Assessment Excel Credit Analysis Accounting Assessment Risk Credit
Analyst,Wipro,Gurugram,38 Yrs,1 Week Ago,Qualifications Experience In Oracle Is A Value Advantage4 Years Of Handson Experienc,Balance Sheet Oracle Journal Entries Accounting Bank Reconciliation Accounts Reconciliation Accounts Receivable Accounts Payable
Vision Plus Developer Analyst,Infosys,Pune,38 Yrs,1 Week Ago,Educational Bachelor Of Engineering Bachelor Of Business Adm Bachelor Of Business ,Mainframes Business Management Technology Solutions Vendor Digital Transformation C Project Management Software Development
Vision Plus Developer Analyst,Infosys,Pune,711 Yrs,1 Week Ago,Educational Bachelor Of Engineering Bachelor Of Technology Integrated Bachelor Of,Mainframes Business Management Technology Solutions Vendor Digital Transformation C Project Management It Program Management
Celonis Coe Analyst,Derisk360,Bengaluru,49 Yrs,1 Week Ago,Qualifications Bachelor S Or Master S Degree In Computer Science Information Systems,Erp Automation Sap Data Modeling Javascript Oracle Technical Support Sql
Atr Analyst,Abiomed,Bengaluru,25 Yrs,1 Week Ago,Flexibility To Work Shifts Aligning With Global Assignments Across Americas Emea And ,Bpo Erp Manager Internal Audit Automation Sap Us Gaap Operational Excellence Financial Reporting
Analyst,Tapad,Hyderabad,03 Yrs,1 Week Ago,The Data Automation Team Supports Multiple Processes In Collaboration With The Ar  B,Erp Automation Data Management Process Improvement Billing Healthcare Data Quality Microsoft
Stackup Analyst,Pi Square Technologies,Bengaluru,38 Yrs,1 Week Ago,Role  Responsibilities Essential Skills Preferred 3 Or More Years Of Experience With ,Nx Sheet Metal Tolerance Stackup Analysis Gd T Automotive Tolerance Stackup Stackup T
Analyst,Wipro,Gurugram,13 Yrs,1 Week Ago,Required Masters Degree In Business Finance Or Related Area Preferred Commercial H,Accounting Capital Market Quantitative Onboarding Finance Financial Analysis Data Analysis Data Interpretation
Copywriting Analyst,Accenture,Mumbai,58 Yrs,1 Week Ago,Qualifications Any Graduation Skill Required Marketing Operations  Medical Affairs,Service Operations Cms Medical Affairs Clinical Research Marketing Operations Medical Writing Medico Marketing Pharmaceutical
Smartsheet Analyst,Euclid Innovations,Warangal Hyderabad Nizamabad,38 Yrs,1 Week Ago,Jp Id Skill Link Time  Date Dltjp00044993 Usicts Smartsheet Anal,Power Bi Analyst 3 Sharepoint Bi Analysis Smartsheet
Ppsm Analyst,Accenture,Hyderabad,35 Yrs,1 Week Ago,Qualifications Any Graduation  Post Graduate In Any Discipline Skill Required Sales ,Service Operations Sales Customer Support Sales Operations Servicenow Team Management Channel Sales Business Development
Ppsm Analyst,Accenture,Bengaluru,35 Yrs,1 Week Ago,Qualifications Any Graduation  Master Of Business Administration  Post Graduate Dipl,Service Operations Accounting Business Administration R2R Finance And Accounts Financial Analysis Data Analysis Data Validation
Independence Analyst,Io,Hyderabad,23 Yrs,1 Week Ago,Jd We Are Looking For A Highly Motivated Professional To Work With Our Internal Quality,New Zealand Hoovers Factiva Secondary Market Research Personal Independence Independence Polices Capital Iq Onesource
Dq Analyst,Tekskills India,Hyderabad Chennai Bengaluru,813 Yrs,1 Week Ago,Strong Communications And Stakeholder Management Skills Should Be Able To Work Effecti,Informatica Data Quality Idq Developer Informatica Idq Idq Data Development Analysis Informatica
Ehmdata Analyst,Robert Bosch Engineering And Business Solutions Private Limited,Coimbatore,26 Yrs,1 Week Ago,Convert Data Into The Required Data Schema To Upload It Into The Data Pipelines For Sim,Computer Science Data Analysis Data Validation Simulation Gcp Signal Processing Algorithm Development Sensors
O2C Analyst,Client Of Solvecube,Chennai,36 Yrs,1 Week Ago, Cash Application  Invoice To Cash  Accounts Receivable Area Must To Have Ability To,O2C Sap Oracle Cash Application Application Cash Order To Cash Cash Applications
Analyst,Kpmg Assurance And Consulting Services Llp,Mumbai,12 Yrs,1 Week Ago,High Level Of Proficiency In Advanced Ms Excel And Ms Powerpoint Is Desirable Be A Qua,Sap Pmo Prpo Analysis
Education Analyst  Physics,People Combine Business Initiatives,Hyderabadmadhapur,01 Yrs,1 Week Ago,Masters In Physics Work Closely With Team Leads Specialized Subjects To Define The Pr,Physics Edtech Content Creation Communication Skills Content Generation Artificial Intelligence Problem Solving Teamwork
Gn  Song  Mt  Hyperpersonalization  Analyst,Accenture,Bengaluru,27 Yrs,2 Weeks Ago,Experienceoverall Experience Of 2 Years With At Least 1 Year Of Experience In The Ban,Project Management Data Analysis Fintech Sales Marketing Risk Management Management Skills Business Analysis
Copywriting Analyst,Accenture,Mumbai,35 Yrs,2 Weeks Ago,Qualifications Any Graduation Skill Required Marketing Operations  Medical Affairs,Talent Management Service Operations Recruitment Leadership Development Training Client Relationship Management Employee Engagement Succession Planning
Analyst,Deloitte Consulting,Thane,03 Yrs,2 Weeks Ago,Preferred Candidate Profile To Keep Client Escalations To A Minimum Have The Ability To,Project Monitoring Ms Project Fresher Hiring Microsoft Hiring Analysis Project Monitoring
Analyst Automotive Sector For Globaldatahyd,Globaldata,Hyderabad,14 Yrs,2 Weeks Ago,Strong Secondary Research Skills And Ms Excel Proficiencyexperience Required  At Leas,Market Forecasting Secondary Research Market Sizing Market Estimation Automotive Vehicle Market Segmentation Market Research
Analyst,Eclerx,Mumbai,03 Yrs,2 Weeks Ago,Inbound  Chat Pune  Fulltime Ft  Customer Operations Shift Timings,Chat Process Inbound Customer Service Sales Crm Non Voice Process Risk Assessment Email Process
Lending Analyst,Deutsche Bank,Pune,26 Yrs,2 Weeks Ago,Should Be Open To Work In Night Shift Education  Certification Should Be Open To Wor,Aml Banking Products Kyc Fatca Debit Note Financial Analysis Anti Money Laundering Investment Banking
Programmer Analyst  Nodejslinux,Idrive Software India Pvt Ltd,Hybrid  Bengaluru,26 Yrs,2 Weeks Ago,This Role Is Ideal For Developers With Handson Experience In Nodejs Redis And Worke,Javascript Nodejs Typescript Python Linux Program Analysis
Tremendous Opening For Ar Analyst In A Classy Mnc,Job Seeks 4U Consultancy Services,Chennai,14 Yrs,2 Days Ago,Rolear Analyst Medical Billing Background Exp 061 Year Salary 21K Must Have  Re,Healthcare Regulations Medical Billing Medical Coding And Billing Medical Claims Claim Payment Insurance Claims Denied Claims Us Healthcare
Analyst,Goldman Sachs,Bengaluru,24 Yrs,1 Week Ago,Bachelor S Degree In Accounting Finance Or Other Business Discipline ,Product Management Data Analysis Automation Wealth Management Wellness Html Investment Banking Information Management
Adops  Analyst,Annalect,Chennai,24 Yrs,1 Week Ago,Capability To Gather And Analyze Complex Data Providing Insight Related To Analytics A,Digital Media Public Relations Advertising Agency Campaign Management Consulting Google Adwords Market Research Support Services
Analyst,Wipro,Gurugram,24 Yrs,1 Week Ago,Essential Skills  Experience Masters In Finance And Bachelors In Technology From A Re,Macros Project Management Dashboard Development Dashboards Vba Data Analysis Software Testing Data Validation
